ID,ChapterID,SectionID,Type,English_Full,Arabic_Full,Notes
38,7,3,section,"In the 1900s, the United States fought other wars, including [ANSWER:World War I], [ANSWER:World War II], [ANSWER:Korean War], [ANSWER:Vietnam War], and [ANSWER:Persian Gulf War] (Q.100). The reasons the United States entered World War I were [ANSWER:Germany attacking U.S. civilian ships] and [ANSWER:to support the Allied Powers] (Q.101). All women gained the right to vote in [ANSWER:1920], [ANSWER:after World War I], through the [ANSWER:19th Amendment to the U.S. Constitution] (Q.102). The Great Depression was [ANSWER:the longest economic recession in modern history] (Q.103). The Great Depression began with [ANSWER:the Great Crash of 1929], or [ANSWER:the stock market crash of 1929] (Q.104). The president during the Great Depression and World War II was [ANSWER:Franklin Roosevelt] (Q.105). The reasons the United States entered World War II were [ANSWER:the bombing of Pearl Harbor], [ANSWER:Japan's attack on Pearl Harbor], [ANSWER:to support the Allied Powers], and [ANSWER:to oppose the Axis Powers] (Q.106). Dwight Eisenhower is famous as [ANSWER:a general during World War II], [ANSWER:president at the end of the Korean War], [ANSWER:the 34th President of the United States], and for [ANSWER:signing the Federal-Aid Highway Act of 1956] (Q.107).",في القرن العشرين، خاضت الولايات المتحدة حروبًا أخرى، بما في ذلك [ANSWER:الحرب العالمية الأولى]، [ANSWER:الحرب العالمية الثانية]، [ANSWER:الحرب الكورية]، [ANSWER:حرب فيتنام]، و [ANSWER:حرب الخليج الفارسي] (Q.100). كانت الأسباب التي دفعت الولايات المتحدة لدخول الحرب العالمية الأولى هي [ANSWER:هجوم ألمانيا على السفن المدنية الأمريكية] و [ANSWER:دعم قوات الحلفاء] (Q.101). حصلت جميع النساء على حق التصويت في [ANSWER:1920]، [ANSWER:بعد الحرب العالمية الأولى]، من خلال [ANSWER:التعديل التاسع عشر لدستور الولايات المتحدة] (Q.102). كان الكساد الكبير هو [ANSWER:أطول ركود اقتصادي في التاريخ الحديث] (Q.103). بدأ الكساد الكبير بـ [ANSWER:الانهيار العظيم عام 1929]، أو [ANSWER:انهيار سوق الأسهم عام 1929] (Q.104). كان الرئيس خلال الكساد الكبير والحرب العالمية الثانية هو [ANSWER:فرانكلين روزفلت] (Q.105). كانت الأسباب التي دفعت الولايات المتحدة لدخول الحرب العالمية الثانية هي [ANSWER:قصف بيرل هاربور]، [ANSWER:هجوم اليابان على بيرل هاربور]، [ANSWER:دعم قوات الحلفاء]، و [ANSWER:معارضة دول المحور] (Q.106). يشتهر دوايت أيزنهاور بأنه [ANSWER:جنرال خلال الحرب العالمية الثانية]، [ANSWER:رئيس في نهاية الحرب الكورية]، [ANSWER:الرئيس الرابع والثلاثون للولايات المتحدة]، و [ANSWER:لتوقيعه قانون المساعدة الفيدرالية للطرق السريعة لعام 1956] (Q.107).,"Ch7 Sec3 | Questions: [100, 101, 102, 103, 104, 105, 106, 107]"
39,8,0,title,Modern America and Proud Symbols,أمريكا الحديثة ورموز الفخر,Chapter 8 Title
40,8,0,introduction,"America's journey continues. Even in modern times, America has faced many challenges and upheld the values of freedom and equality. Now let's learn about the symbols that represent America.",تستمر رحلة أمريكا. حتى في العصر الحديث، واجهت أمريكا العديد من التحديات وحافظت على قيم الحرية والمساواة. الآن دعنا نتعرف على الرموز التي تمثل أمريكا.,Chapter 8 Introduction
41,8,1,section,"During the Cold War, America's main rivals were the Soviet Union, also known as the Soviet Union or Russia (Q.108). During the Cold War, America's biggest worries were Communism and nuclear war (Q.109). The United States participated in the Korean War to stop the spread of Communism (Q.110), and for the same reason, participated in the Vietnam War (Q.111). American civil rights movements fought to end racial discrimination (Q.112). Martin Luther King, Jr. fought for civil rights, struggled for equality in America, and worked for people to be judged by who they are, not by the color of their skin (Q.113). The United States participated in the Persian Gulf War to drive the Iraqi army out of Kuwait (Q.114).",خلال الحرب الباردة، كان المنافسون الرئيسيون لأمريكا هم الاتحاد السوفيتي، المعروف أيضًا بالاتحاد السوفيتي أو روسيا (Q.108). خلال الحرب الباردة، كانت أكبر مخاوف أمريكا هي الشيوعية والحرب النووية (Q.109). شاركت الولايات المتحدة في الحرب الكورية لوقف انتشار الشيوعية (Q.110)، وللسبب نفسه، شاركت في حرب فيتنام (Q.111). حاربت حركات الحقوق المدنية الأمريكية لإنهاء التمييز العنصري (Q.112). ناضل مارتن لوثر كينغ جونيور من أجل الحقوق المدنية، وكافح من أجل المساواة في أمريكا، وعمل لكي يُحكم على الناس بما هم عليه، وليس بلون بشرتهم (Q.113). شاركت الولايات المتحدة في حرب الخليج الفارسي لطرد الجيش العراقي من الكويت (Q.114).,"Ch8 Sec1 | Questions: [108, 109, 110, 111, 112, 113, 114]"
42,8,2,section,"In the United States, a major event occurred on September 11, 2001. [ANSWER:Terrorists attacked the United States], [ANSWER:Terrorists hijacked two planes and crashed them into the World Trade Center in New York City], and [ANSWER:Terrorists hijacked a plane and crashed it into the Pentagon in Arlington, Virginia] (Q.115). After the attacks of September 11, 2001, U.S. military conflicts included the [ANSWER:Global War on Terror], [ANSWER:War in Afghanistan], and [ANSWER:Iraq War] (Q.116). Many Native American tribes in the United States include the [ANSWER:Apache], [ANSWER:Cherokee], [ANSWER:Navajo], and [ANSWER:Sioux] (Q.117). Examples of American innovation include the [ANSWER:light bulb], [ANSWER:automobile], [ANSWER:skyscraper], [ANSWER:airplane], [ANSWER:assembly line], and [ANSWER:moon landing] (Q.118). The capital of the United States is [ANSWER:Washington D.C.] (Q.119). The Statue of Liberty is located in [ANSWER:New York Harbor], [ANSWER:Liberty Island] (Q.120).",في الولايات المتحدة، وقع حدث كبير في 11 سبتمبر 2001. [الإجابة: هاجم الإرهابيون الولايات المتحدة]، [الإجابة: اختطف الإرهابيون طائرتين واصطدموا بهما في مركز التجارة العالمي في مدينة نيويورك]، و [الإجابة: اختطف الإرهابيون طائرة واصطدموا بها في البنتاغون في أرلينغتون، فيرجينيا] (س.115). بعد هجمات 11 سبتمبر 2001، شملت الصراعات العسكرية الأمريكية [الإجابة: الحرب العالمية على الإرهاب]، [الإجابة: الحرب في أفغانستان]، و [الإجابة: حرب العراق] (س.116). تشمل العديد من القبائل الأمريكية الأصلية في الولايات المتحدة [الإجابة: الأباتشي]، [الإجابة: الشيروكي]، [الإجابة: النافاجو]، و [الإجابة: السو] (س.117). تشمل أمثلة الابتكار الأمريكي [الإجابة: المصباح الكهربائي]، [الإجابة: السيارة]، [الإجابة: ناطحة السحاب]، [الإجابة: الطائرة]، [الإجابة: خط التجميع]، و [الإجابة: الهبوط على القمر] (س.118). عاصمة الولايات المتحدة هي [الإجابة: واشنطن العاصمة] (س.119). يقع تمثال الحرية في [الإجابة: ميناء نيويورك]، [الإجابة: جزيرة ليبرتي] (س.120).,"Ch8 Sec2 | Questions: [115, 116, 117, 118, 119, 120]"
43,8,3,section,"Why does the American flag have 13 stripes? [ANSWER:Because there were 13 original colonies], and [ANSWER:the stripes represent the 13 original colonies] (Q.121). Why does the American flag have 50 stars? [ANSWER:Because there is one star for each state], and [ANSWER:each star represents a state], and [ANSWER:because there are 50 states] (Q.122). The name of the national flag is the [ANSWER:Stars and Stripes] (Q.123). The first motto of this nation is 'E Pluribus Unum', which means [ANSWER:out of many, one], [ANSWER:all become one] (Q.124). Independence Day is [ANSWER:a holiday celebrating America's independence from Britain], that is, [ANSWER:the nation's birthday] (Q.125). U.S. national holidays include [ANSWER:New Year's Day], [ANSWER:Martin Luther King, Jr. Day], [ANSWER:Presidents' Day], [ANSWER:Memorial Day], [ANSWER:Independence Day], [ANSWER:Labor Day], [ANSWER:Veterans Day], [ANSWER:Thanksgiving], and [ANSWER:Christmas] (Q.126). Memorial Day is [ANSWER:a holiday to honor soldiers who died while serving in the military] (Q.127). Veterans Day is [ANSWER:a holiday to honor those who belong to the U.S. military], [ANSWER:a holiday to honor people who served in the U.S. military] (Q.128).","لماذا يحتوي العلم الأمريكي على 13 شريطًا؟ [الإجابة: لأنه كان هناك 13 مستعمرة أصلية]، و [الإجابة: تمثل الخطوط المستعمرات الأصلية الـ 13] (س.121). لماذا يحتوي العلم الأمريكي على 50 نجمة؟ [الإجابة: لأنه توجد نجمة واحدة لكل ولاية]، و [الإجابة: تمثل كل نجمة ولاية]، و [الإجابة: لأنه توجد 50 ولاية] (س.122). اسم العلم الوطني هو [الإجابة: النجوم والخطوط] (س.123). الشعار الأول لهذه الأمة هو ""E Pluribus Unum""، والذي يعني [الإجابة: من الكثرة واحد]، [الإجابة: الجميع يصبح واحدًا] (س.124). عيد الاستقلال هو [الإجابة: عطلة تحتفل باستقلال أمريكا عن بريطانيا]، أي [الإجابة: عيد ميلاد الأمة] (س.125). تشمل العطلات الوطنية للولايات المتحدة [الإجابة: رأس السنة الجديدة]، [الإجابة: يوم مارتن لوثر كينغ جونيور]، [الإجابة: يوم الرؤساء]، [الإجابة: يوم الذكرى]، [الإجابة: عيد الاستقلال]، [الإجابة: عيد العمال]، [الإجابة: يوم المحاربين القدامى]، [الإجابة: عيد الشكر]، و [الإجابة: عيد الميلاد] (س.126). يوم الذكرى هو [الإجابة: عطلة لتكريم الجنود الذين ماتوا أثناء خدمتهم في الجيش] (س.127). يوم المحاربين القدامى هو [الإجابة: عطلة لتكريم أولئك الذين ينتمون إلى الجيش الأمريكي]، [الإجابة: عطلة لتكريم الأشخاص الذين خدموا في الجيش الأمريكي] (س.128).","Ch8 Sec3 | Questions: [121, 122, 123, 124, 125, 126, 127, 128]"
