ID,ChapterID,SectionID,Type,English_Full,Arabic_Full,Notes
24,5,0,introduction,"Now that we understand the government's structure, it's time to learn about our rights and responsibilities as citizens. To live in a free country, responsibilities are just as important as rights.",الآن بعد أن فهمنا هيكل الحكومة، حان الوقت للتعرف على حقوقنا ومسؤولياتنا كمواطنين. للعيش في بلد حر، المسؤوليات لا تقل أهمية عن الحقوق.,Chapter 5 Introduction
25,5,1,section,"The Constitution has four amendments about who can vote. [ANSWER:Citizens 18 years and older can vote], [ANSWER:you don't have to pay a poll tax to vote], and [ANSWER:any citizen can vote] (women or men). Also, [ANSWER:male citizens of any race can vote] (Q.63). So who can vote in federal elections, run for federal office, and serve as a juror in the United States? It's the [ANSWER:citizens], that is, [ANSWER:citizens of the United States], [ANSWER:U.S. citizens] (Q.64). But there are also rights that everyone living in the United States has. These are [ANSWER:freedom of expression], [ANSWER:freedom of speech], [ANSWER:freedom of assembly], [ANSWER:freedom to petition the government], [ANSWER:freedom of religion], and [ANSWER:the right to bear arms] (Q.65).",يحتوي الدستور على أربعة تعديلات حول من يمكنه التصويت. [الإجابة: يمكن للمواطنين الذين يبلغون 18 عامًا فما فوق التصويت]، [الإجابة: لا يتوجب عليك دفع ضريبة اقتراع للتصويت]، و [الإجابة: يمكن لأي مواطن التصويت] (نساء أو رجال). أيضًا، [الإجابة: يمكن للمواطنين الذكور من أي عرق التصويت] (س63). فمن يمكنه التصويت في الانتخابات الفيدرالية، والترشح للمناصب الفيدرالية، والعمل كعضو هيئة محلفين في الولايات المتحدة؟ إنهم [الإجابة: المواطنون]، أي [الإجابة: مواطنو الولايات المتحدة]، [الإجابة: مواطنو الولايات المتحدة الأمريكية] (س64). ولكن هناك أيضًا حقوق يتمتع بها كل من يعيش في الولايات المتحدة. هذه هي [الإجابة: حرية التعبير]، [الإجابة: حرية الكلام]، [الإجابة: حرية التجمع]، [الإجابة: حرية تقديم الالتماسات للحكومة]، [الإجابة: حرية الدين]، و [الإجابة: الحق في حمل السلاح] (س65).,"Ch5 Sec1 | Questions: [63, 64, 65]"
26,5,2,section,"When we say the Pledge of Allegiance, to what do we pledge our loyalty? We pledge loyalty to the [ANSWER:United States] and to the [ANSWER:flag] (Q.66). In the Oath of Allegiance for new citizens, two important promises are made: to [ANSWER:give up loyalty to other countries], to [ANSWER:defend the United States], to [ANSWER:obey the Constitution], to [ANSWER:obey the laws of the United States], to [ANSWER:serve in the U.S. military] if needed, to [ANSWER:perform important work for the nation] if needed, and to [ANSWER:be loyal to the United States] (Q.67). So, how do people become U.S. citizens? People become citizens by [ANSWER:being born in the United States under the conditions specified in the 14th Amendment to the U.S. Constitution], through [ANSWER:naturalization], or by [ANSWER:obtaining citizenship] (according to conditions set by Congress) (Q.68).",عندما نقول قسم الولاء، لمن نعهد بولائنا؟ نعهد بالولاء لـ [ANSWER:الولايات المتحدة] و [ANSWER:العلم] (س.66). في قسم الولاء للمواطنين الجدد، يتم تقديم وعدين مهمين: [ANSWER:التخلي عن الولاء للبلدان الأخرى]، و [ANSWER:الدفاع عن الولايات المتحدة]، و [ANSWER:طاعة الدستور]، و [ANSWER:طاعة قوانين الولايات المتحدة]، و [ANSWER:الخدمة في الجيش الأمريكي] إذا لزم الأمر، و [ANSWER:أداء عمل مهم للأمة] إذا لزم الأمر، و [ANSWER:أن تكون مخلصًا للولايات المتحدة] (س.67). إذن، كيف يصبح الناس مواطنين أمريكيين؟ يصبح الناس مواطنين عن طريق [ANSWER:الولادة في الولايات المتحدة بموجب الشروط المحددة في التعديل الرابع عشر لدستور الولايات المتحدة]، أو من خلال [ANSWER:التجنس]، أو عن طريق [ANSWER:الحصول على الجنسية] (وفقًا للشروط التي يحددها الكونجرس) (س.68).,"Ch5 Sec2 | Questions: [66, 67, 68]"
27,5,3,section,"There are many ways for citizens to participate in America. These include [ANSWER:voting], [ANSWER:running for office], [ANSWER:joining a political party], [ANSWER:helping with a campaign], [ANSWER:joining a civic group], [ANSWER:joining a local group], [ANSWER:giving an elected official your opinion on an issue], [ANSWER:calling Senators and Representatives], [ANSWER:publicly supporting or opposing an issue or policy], and [ANSWER:writing to a newspaper] (Q.69). There are also various ways for Americans to serve their country. These include [ANSWER:voting], [ANSWER:paying taxes], [ANSWER:obeying the law], [ANSWER:serving in the military], [ANSWER:running for office], and [ANSWER:serving in local, state, or federal government] (Q.70). Why is it important to pay federal taxes? It is [ANSWER:required by law], and [ANSWER:everyone pays taxes to support the federal government]. It is [ANSWER:what America requires], and it is a [ANSWER:civic duty] specified in the [ANSWER:16th Amendment to the Constitution] (Q.71). Finally, all men aged 18 to 25 must register with Selective Service because it is [ANSWER:required by law], it is a [ANSWER:civic duty], and it is to [ANSWER:make the draft fair, if needed] (Q.72).",هناك العديد من الطرق للمواطنين للمشاركة في أمريكا. وتشمل هذه [ANSWER:التصويت]، [ANSWER:الترشح للمناصب]، [ANSWER:الانضمام إلى حزب سياسي]، [ANSWER:المساعدة في حملة انتخابية]، [ANSWER:الانضمام إلى مجموعة مدنية]، [ANSWER:الانضمام إلى مجموعة محلية]، [ANSWER:إعطاء رأيك في قضية لمسؤول منتخب]، [ANSWER:الاتصال بأعضاء مجلس الشيوخ والنواب]، [ANSWER:الدعم العلني أو معارضة قضية أو سياسة]، و [ANSWER:الكتابة إلى صحيفة] (س.69). هناك أيضًا طرق مختلفة للأمريكيين لخدمة بلدهم. وتشمل هذه [ANSWER:التصويت]، [ANSWER:دفع الضرائب]، [ANSWER:الامتثال للقانون]، [ANSWER:الخدمة في الجيش]، [ANSWER:الترشح للمناصب]، و [ANSWER:الخدمة في الحكومة المحلية أو الولائية أو الفيدرالية] (س.70). لماذا من المهم دفع الضرائب الفيدرالية؟ إنها [ANSWER:مطلوبة بموجب القانون]، و [ANSWER:يدفع الجميع الضرائب لدعم الحكومة الفيدرالية]. إنها [ANSWER:ما تتطلبه أمريكا]، وهي [ANSWER:واجب مدني] محدد في [ANSWER:التعديل السادس عشر للدستور] (س.71). أخيرًا، يجب على جميع الرجال الذين تتراوح أعمارهم بين 18 و 25 عامًا التسجيل في الخدمة الانتقائية لأنها [ANSWER:مطلوبة بموجب القانون]، وهي [ANSWER:واجب مدني]، ول [ANSWER:جعل التجنيد عادلاً، إذا لزم الأمر] (س.72).,"Ch5 Sec3 | Questions: [69, 70, 71, 72]"
28,6,0,title,Journey to Freedom: From Colonies to Independence,رحلة إلى الحرية: من المستعمرات إلى الاستقلال,Chapter 6 Title
29,6,0,introduction,"It's time to learn how America was born. Long ago, people dreaming of a new life crossed the Atlantic Ocean to this land, and their descendants fought for freedom.",حان الوقت لنتعلم كيف وُلدت أمريكا. منذ زمن بعيد، عبر أناس يحلمون بحياة جديدة المحيط الأطلسي إلى هذه الأرض، وقاتل أحفادهم من أجل الحرية.,Chapter 6 Introduction
30,6,1,section,"The colonists came to America for many reasons: [ANSWER:freedom], [ANSWER:political liberty], [ANSWER:religious freedom], [ANSWER:economic opportunity], and to [ANSWER:escape persecution] (Q.73). However, before the Europeans arrived, people already lived on this land. They were the [ANSWER:American Indians], also known as [ANSWER:Native Americans] (Q.74). There was also a sad history: [ANSWER:Africans], or [ANSWER:people from Africa], were captured and sold as slaves (Q.75). Over time, the colonists became unhappy with British rule, and eventually, Americans fought a war to gain independence from Britain. This was the [ANSWER:American Revolution], also known as [ANSWER:the American Revolutionary War], or the [ANSWER:War for American Independence] (Q.76). There were many reasons why the United States declared its independence from Great Britain, including [ANSWER:high taxes], [ANSWER:taxation without representation], [ANSWER:British soldiers stayed in colonists' houses], [ANSWER:no self-government], [ANSWER:the Boston Massacre], and [ANSWER:the Boston Tea Party] (Q.77).",جاء المستعمرون إلى أمريكا لأسباب عديدة: [الإجابة:الحرية]، [الإجابة:الحرية السياسية]، [الإجابة:الحرية الدينية]، [الإجابة:الفرصة الاقتصادية]، و [الإجابة:الهروب من الاضطهاد] (س.73). ومع ذلك، قبل وصول الأوروبيين، كان الناس يعيشون بالفعل على هذه الأرض. كانوا [الإجابة:الهنود الأمريكيون]، المعروفون أيضاً باسم [الإجابة:السكان الأصليون لأمريكا] (س.74). كان هناك أيضاً تاريخ حزين: [الإجابة:الأفارقة]، أو [الإجابة:الأشخاص من إفريقيا]، تم أسرهم وبيعهم كعبيد (س.75). مع مرور الوقت، أصبح المستعمرون غير راضين عن الحكم البريطاني، وفي النهاية، خاض الأمريكيون حرباً لكسب الاستقلال عن بريطانيا. كانت هذه [الإجابة:الثورة الأمريكية]، والمعروفة أيضاً باسم [الإجابة:الحرب الثورية الأمريكية]، أو [الإجابة:حرب الاستقلال الأمريكية] (س.76). كانت هناك أسباب عديدة لإعلان الولايات المتحدة استقلالها عن بريطانيا العظمى، بما في ذلك [الإجابة:الضرائب المرتفعة]، [الإجابة:الضرائب بدون تمثيل]، [الإجابة:بقاء الجنود البريطانيين في منازل المستعمرين]، [الإجابة:عدم وجود حكم ذاتي]، [الإجابة:مذبحة بوسطن]، و [الإجابة:حفلة شاي بوسطن] (س.77).,"Ch6 Sec1 | Questions: [73, 74, 75, 76, 77]"
31,6,2,section,"The Declaration of Independence was written by [ANSWER:Thomas Jefferson] (Q.78). And the date the Declaration of Independence was adopted is [ANSWER:July 4, 1776] (Q.79). There were many important events during the American Revolution. These included the [ANSWER:Battle of Bunker Hill], the [ANSWER:Declaration of Independence], [ANSWER:Washington's Crossing of the Delaware], the [ANSWER:Battle of Saratoga], the [ANSWER:Encampment at Valley Forge], and the [ANSWER:Battle of Yorktown] (Q.80). Initially, there were 13 states: [ANSWER:New Hampshire], [ANSWER:Massachusetts], [ANSWER:Rhode Island], [ANSWER:Connecticut], [ANSWER:New York], [ANSWER:New Jersey], [ANSWER:Pennsylvania], [ANSWER:Delaware], [ANSWER:Maryland], [ANSWER:Virginia], [ANSWER:North Carolina], [ANSWER:South Carolina], and [ANSWER:Georgia] (Q.81). And in 1787, an important founding document was drafted. That was the [ANSWER:U.S. Constitution] (Q.82).",تمت كتابة إعلان الاستقلال بواسطة [ANSWER: توماس جيفرسون] (Q.78). وتاريخ اعتماد إعلان الاستقلال هو [ANSWER: 4 يوليو 1776] (Q.79). كانت هناك العديد من الأحداث الهامة خلال الثورة الأمريكية. وشملت هذه [ANSWER: معركة بنكر هيل]، [ANSWER: إعلان الاستقلال]، [ANSWER: عبور واشنطن لنهر ديلاوير]، [ANSWER: معركة ساراتوجا]، [ANSWER: معسكر فالي فورج]، و[ANSWER: معركة يوركتاون] (Q.80). في البداية، كانت هناك 13 ولاية: [ANSWER: نيوهامبشير]، [ANSWER: ماساتشوستس]، [ANSWER: رود آيلاند]، [ANSWER: كونيتيكت]، [ANSWER: نيويورك]، [ANSWER: نيوجيرسي]، [ANSWER: بنسلفانيا]، [ANSWER: ديلاوير]، [ANSWER: ماريلاند]، [ANSWER: فيرجينيا]، [ANSWER: كارولينا الشمالية]، [ANSWER: كارولينا الجنوبية]، و[ANSWER: جورجيا] (Q.81). وفي عام 1787، تم صياغة وثيقة تأسيسية هامة. وكانت تلك هي [ANSWER: دستور الولايات المتحدة] (Q.82).,"Ch6 Sec2 | Questions: [78, 79, 80, 81, 82]"
32,6,3,section,"The Federalist Papers supported the passage of the U.S. Constitution. Its authors were known by the pseudonym [ANSWER:Publius], either [ANSWER:James Madison], [ANSWER:Alexander Hamilton], or [ANSWER:John Jay] (Q.83). The Federalist Papers are important because they [ANSWER:helped people understand the U.S. Constitution] and [ANSWER:supported the passage of the U.S. Constitution] (Q.84). Benjamin Franklin is famous for many reasons, including [ANSWER:founding the first free public libraries], [ANSWER:being the first Postmaster General of the U.S.], [ANSWER:helping to write the Declaration of Independence], [ANSWER:being an inventor], and [ANSWER:being a U.S. diplomat] (Q.85). George Washington is famous as [ANSWER:the Father of Our Country], [ANSWER:the first President of the United States], [ANSWER:the General of the Continental Army], and [ANSWER:the President of the Constitutional Convention] (Q.86).",لقد دعمت أوراق الفيدراليين إقرار دستور الولايات المتحدة. كان مؤلفوها معروفين بالاسم المستعار [ANSWER:ببليوس]، إما [ANSWER:جيمس ماديسون]، أو [ANSWER:ألكسندر هاملتون]، أو [ANSWER:جون جاي] (Q.83). تعتبر أوراق الفيدراليين مهمة لأنها [ANSWER:ساعدت الناس على فهم دستور الولايات المتحدة] و [ANSWER:دعمت إقرار دستور الولايات المتحدة] (Q.84). يشتهر بنجامين فرانكلين بالعديد من الأسباب، بما في ذلك [ANSWER:تأسيس أول مكتبات عامة مجانية]، [ANSWER:كونه أول مدير عام للبريد في الولايات المتحدة]، [ANSWER:المساعدة في كتابة إعلان الاستقلال]، [ANSWER:كونه مخترعًا]، و [ANSWER:كونه دبلوماسيًا أمريكيًا] (Q.85). يشتهر جورج واشنطن بكونه [ANSWER:أبا بلادنا]، [ANSWER:أول رئيس للولايات المتحدة]، [ANSWER:قائد الجيش القاري]، و [ANSWER:رئيس المؤتمر الدستوري] (Q.86).,"Ch6 Sec3 | Questions: [83, 84, 85, 86]"
33,6,4,section,"Thomas Jefferson is famous for various reasons. These include being the [ANSWER:Author of the Declaration of Independence], [ANSWER:Third President of the United States], [ANSWER:Doubled the size of the U.S. territory with the Louisiana Purchase], [ANSWER:First Secretary of State], and [ANSWER:Founder of the University of Virginia] (Q.87). James Madison is known as the [ANSWER:Father of the Constitution], [ANSWER:Fourth President of the United States], [ANSWER:President during the War of 1812], and [ANSWER:One of the writers of the Federalist Papers] (Q.88). Alexander Hamilton is famous as the [ANSWER:First Secretary of the Treasury], [ANSWER:One of the writers of the Federalist Papers], [ANSWER:Helped establish the first bank of the United States], and [ANSWER:Aide to General George Washington] (Q.89). Lastly, the territory the United States bought from France in 1803 was the [ANSWER:Louisiana Territory], or [ANSWER:Louisiana] (Q.90).",يشتهر توماس جيفرسون لأسباب مختلفة. وتشمل هذه كونه [ANSWER:مؤلف إعلان الاستقلال]، [ANSWER:الرئيس الثالث للولايات المتحدة]، [ANSWER:ضاعف حجم أراضي الولايات المتحدة بصفقة شراء لويزيانا]، [ANSWER:أول وزير خارجية]، و [ANSWER:مؤسس جامعة فيرجينيا] (Q.87). يُعرف جيمس ماديسون بأنه [ANSWER:أبو الدستور]، [ANSWER:الرئيس الرابع للولايات المتحدة]، [ANSWER:الرئيس خلال حرب عام 1812]، و [ANSWER:أحد كتاب الأوراق الفيدرالية] (Q.88). يشتهر ألكسندر هاميلتون بصفته [ANSWER:أول وزير للخزانة]، [ANSWER:أحد كتاب الأوراق الفيدرالية]، [ANSWER:ساعد في إنشاء أول بنك للولايات المتحدة]، و [ANSWER:مساعد الجنرال جورج واشنطن] (Q.89). أخيرًا، الإقليم الذي اشترته الولايات المتحدة من فرنسا عام 1803 كان [ANSWER:إقليم لويزيانا]، أو [ANSWER:لويزيانا] (Q.90).,"Ch6 Sec4 | Questions: [87, 88, 89, 90]"
34,7,0,title,Trials and Growth: America in the 1800s,تجارب ونمو: أمريكا في القرن التاسع عشر,Chapter 7 Title
35,7,0,introduction,"The 1800s were a time of great trials for America. There were wars and conflicts, but within them were also great steps toward freedom and equality.",كانت فترة ثمانينيات القرن التاسع عشر فترة محفوفة بالعديد من التجارب لأمريكا. لقد شهدت حروبًا وصراعات، ولكنها أيضًا شهدت خطوات عظيمة نحو الحرية والمساواة.,Chapter 7 Introduction
36,7,1,section,"In the 1800s, America fought several wars. These included the [ANSWER:War of 1812], the [ANSWER:Mexican-American War], the [ANSWER:Civil War], and the [ANSWER:Spanish-American War] (Q.91). The most tragic of these was the [ANSWER:Civil War], fought between the North and the South (Q.92). Many important events occurred during the Civil War. These included the [ANSWER:Battle of Fort Sumter], the [ANSWER:Emancipation Proclamation], the [ANSWER:Battle of Vicksburg], the [ANSWER:Battle of Gettysburg], [ANSWER:Sherman's March], [ANSWER:Appomattox Surrender], and [ANSWER:Lincoln's Assassination] (Q.93). The greatest leader of this period was Abraham Lincoln. He [ANSWER:freed the slaves], [ANSWER:preserved the Union], [ANSWER:led the United States during the Civil War], was the [ANSWER:16th President of the United States], and is famous for the [ANSWER:Gettysburg Address] (Q.94). The Emancipation Proclamation [ANSWER:freed the slaves], [ANSWER:freed slaves in the Confederacy], and [ANSWER:freed slaves in most Southern states] (Q.95).",في القرن التاسع عشر، خاضت أمريكا عدة حروب. وشملت هذه [الإجابة: حرب عام 1812]، و[الإجابة: الحرب المكسيكية الأمريكية]، و[الإجابة: الحرب الأهلية]، و[الإجابة: الحرب الإسبانية الأمريكية] (س 91). وكانت أكثرها مأساوية [الإجابة: الحرب الأهلية]، التي دارت بين الشمال والجنوب (س 92). وقعت العديد من الأحداث الهامة خلال الحرب الأهلية. وشملت هذه [الإجابة: معركة فورت سمتر]، و[الإجابة: إعلان تحرير العبيد]، و[الإجابة: معركة فيكسبيرغ]، و[الإجابة: معركة جيتيسبيرغ]، و[الإجابة: مسيرة شيرمان]، و[الإجابة: استسلام أبوماتوكس]، و[الإجابة: اغتيال لينكولن] (س 93). كان أعظم قائد في هذه الفترة هو أبراهام لينكولن. وقد [الإجابة: حرر العبيد]، و[الإجابة: حافظ على الاتحاد]، و[الإجابة: قاد الولايات المتحدة خلال الحرب الأهلية]، وكان [الإجابة: الرئيس السادس عشر للولايات المتحدة]، ويشتهر بـ [الإجابة: خطاب جيتيسبيرغ] (س 94). إعلان تحرير العبيد [الإجابة: حرر العبيد]، و[الإجابة: حرر العبيد في الكونفدرالية]، و[الإجابة: حرر العبيد في معظم الولايات الجنوبية] (س 95).,"Ch7 Sec1 | Questions: [91, 92, 93, 94, 95]"
37,7,2,section,"The [ANSWER:American Civil War] ended slavery in the United States (Q.96). After the war, important constitutional amendments were made. The [ANSWER:14th Amendment to the U.S. Constitution] defined all persons born or naturalized in the United States and subject to its jurisdiction as citizens of the United States (Q.97). And it was [ANSWER:after the Civil War], [ANSWER:during the Reconstruction Era], by the [ANSWER:15th Amendment to the U.S. Constitution], in [ANSWER:1870], that all men gained the right to vote (Q.98). Leaders of the women's rights movement in the 1800s included [ANSWER:Susan B. Anthony], [ANSWER:Elizabeth Cady Stanton], [ANSWER:Sojourner Truth], and [ANSWER:Harriet Tubman] (Q.99).",أنهت [الإجابة:الحرب الأهلية الأمريكية] العبودية في الولايات المتحدة (س 96). بعد الحرب، تم إجراء تعديلات دستورية مهمة. عرّف [الإجابة:التعديل الرابع عشر لدستور الولايات المتحدة] جميع الأشخاص المولودين أو المتجنسين في الولايات المتحدة والخاضعين لولايتها القضائية كمواطنين للولايات المتحدة (س 97). وكان [الإجابة:بعد الحرب الأهلية]، [الإجابة:خلال عصر إعادة الإعمار]، بموجب [الإجابة:التعديل الخامس عشر لدستور الولايات المتحدة]، في [الإجابة:1870]، أن جميع الرجال حصلوا على حق التصويت (س 98). شمل قادة حركة حقوق المرأة في القرن التاسع عشر [الإجابة:سوزان ب. أنتوني]، [الإجابة:إليزابيث كادي ستانتون]، [الإجابة:سوجورنر تروث]، و [الإجابة:هارييت توبمان] (س 99).,"Ch7 Sec2 | Questions: [96, 97, 98, 99]"
