ID,ChapterID,SectionID,Type,English_Full,Vietnam_Full,Notes
25,5,1,section,"The Constitution has four amendments about who can vote. [ANSWER:Citizens 18 years and older can vote], [ANSWER:you don't have to pay a poll tax to vote], and [ANSWER:any citizen can vote] (women or men). Also, [ANSWER:male citizens of any race can vote] (Q.63). So who can vote in federal elections, run for federal office, and serve as a juror in the United States? It's the [ANSWER:citizens], that is, [ANSWER:citizens of the United States], [ANSWER:U.S. citizens] (Q.64). But there are also rights that everyone living in the United States has. These are [ANSWER:freedom of expression], [ANSWER:freedom of speech], [ANSWER:freedom of assembly], [ANSWER:freedom to petition the government], [ANSWER:freedom of religion], and [ANSWER:the right to bear arms] (Q.65).","Hiến pháp có bốn sửa đổi về những người có thể bỏ phiếu. [TRẢ LỜI:Công dân từ 18 tuổi trở lên có thể bỏ phiếu], [TRẢ LỜI:bạn không phải trả thuế thân để bỏ phiếu], và [TRẢ LỜI:bất kỳ công dân nào cũng có thể bỏ phiếu] (phụ nữ hoặc nam giới). Ngoài ra, [TRẢ LỜI:công dân nam giới thuộc bất kỳ chủng tộc nào cũng có thể bỏ phiếu] (Q.63). Vậy ai có thể bỏ phiếu trong các cuộc bầu cử liên bang, tranh cử chức vụ liên bang và phục vụ với tư cách bồi thẩm đoàn ở Hoa Kỳ? Đó là [TRẢ LỜI:các công dân], tức là, [TRẢ LỜI:công dân Hoa Kỳ], [TRẢ LỜI:công dân Hoa Kỳ] (Q.64). Nhưng cũng có những quyền mà mọi người sống ở Hoa Kỳ đều có. Đó là [TRẢ LỜI:tự do ngôn luận], [TRẢ LỜI:tự do phát biểu], [TRẢ LỜI:tự do hội họp], [TRẢ LỜI:tự do kiến nghị chính phủ], [TRẢ LỜI:tự do tôn giáo], và [TRẢ LỜI:quyền mang vũ khí] (Q.65).","Ch5 Sec1 | Questions: [63, 64, 65]"
26,5,2,section,"When we say the Pledge of Allegiance, to what do we pledge our loyalty? We pledge loyalty to the [ANSWER:United States] and to the [ANSWER:flag] (Q.66). In the Oath of Allegiance for new citizens, two important promises are made: to [ANSWER:give up loyalty to other countries], to [ANSWER:defend the United States], to [ANSWER:obey the Constitution], to [ANSWER:obey the laws of the United States], to [ANSWER:serve in the U.S. military] if needed, to [ANSWER:perform important work for the nation] if needed, and to [ANSWER:be loyal to the United States] (Q.67). So, how do people become U.S. citizens? People become citizens by [ANSWER:being born in the United States under the conditions specified in the 14th Amendment to the U.S. Constitution], through [ANSWER:naturalization], or by [ANSWER:obtaining citizenship] (according to conditions set by Congress) (Q.68).","Khi chúng ta đọc Lời Tuyên Thệ Trung Thành, chúng ta cam kết trung thành với điều gì? Chúng ta cam kết trung thành với [TRẢ LỜI:Hợp chủng quốc Hoa Kỳ] và [TRẢ LỜI:quốc kỳ] (Q.66). Trong Lời Tuyên Thệ Trung Thành dành cho công dân mới, hai lời hứa quan trọng được đưa ra: [TRẢ LỜI:từ bỏ lòng trung thành với các quốc gia khác], [TRẢ LỜI:bảo vệ Hợp chủng quốc Hoa Kỳ], [TRẢ LỜI:tuân thủ Hiến pháp], [TRẢ LỜI:tuân thủ luật pháp của Hợp chủng quốc Hoa Kỳ], [TRẢ LỜI:phục vụ trong quân đội Hoa Kỳ] nếu cần, [TRẢ LỜI:thực hiện công việc quan trọng cho quốc gia] nếu cần, và [TRẢ LỜI:trung thành với Hợp chủng quốc Hoa Kỳ] (Q.67). Vậy, làm thế nào để mọi người trở thành công dân Hoa Kỳ? Mọi người trở thành công dân bằng cách [TRẢ LỜI:sinh ra tại Hợp chủng quốc Hoa Kỳ theo các điều kiện được quy định trong Tu chính án thứ 14 của Hiến pháp Hoa Kỳ], thông qua [TRẢ LỜI:nhập tịch], hoặc bằng cách [TRẢ LỜI:nhận quốc tịch] (theo các điều kiện do Quốc hội đặt ra) (Q.68).","Ch5 Sec2 | Questions: [66, 67, 68]"
27,5,3,section,"There are many ways for citizens to participate in America. These include [ANSWER:voting], [ANSWER:running for office], [ANSWER:joining a political party], [ANSWER:helping with a campaign], [ANSWER:joining a civic group], [ANSWER:joining a local group], [ANSWER:giving an elected official your opinion on an issue], [ANSWER:calling Senators and Representatives], [ANSWER:publicly supporting or opposing an issue or policy], and [ANSWER:writing to a newspaper] (Q.69). There are also various ways for Americans to serve their country. These include [ANSWER:voting], [ANSWER:paying taxes], [ANSWER:obeying the law], [ANSWER:serving in the military], [ANSWER:running for office], and [ANSWER:serving in local, state, or federal government] (Q.70). Why is it important to pay federal taxes? It is [ANSWER:required by law], and [ANSWER:everyone pays taxes to support the federal government]. It is [ANSWER:what America requires], and it is a [ANSWER:civic duty] specified in the [ANSWER:16th Amendment to the Constitution] (Q.71). Finally, all men aged 18 to 25 must register with Selective Service because it is [ANSWER:required by law], it is a [ANSWER:civic duty], and it is to [ANSWER:make the draft fair, if needed] (Q.72).","Có nhiều cách để công dân tham gia vào nước Mỹ. Bao gồm [ANSWER:bỏ phiếu], [ANSWER:ứng cử], [ANSWER:tham gia một đảng phái chính trị], [ANSWER:giúp đỡ một chiến dịch], [ANSWER:tham gia một nhóm dân sự], [ANSWER:tham gia một nhóm địa phương], [ANSWER:đưa ra ý kiến của bạn về một vấn đề cho một quan chức được bầu], [ANSWER:gọi điện cho các Thượng nghị sĩ và Đại diện], [ANSWER:công khai ủng hộ hoặc phản đối một vấn đề hoặc chính sách], và [ANSWER:viết thư cho một tờ báo] (Q.69). Cũng có nhiều cách khác nhau để người Mỹ phục vụ đất nước của họ. Bao gồm [ANSWER:bỏ phiếu], [ANSWER:đóng thuế], [ANSWER:tuân thủ pháp luật], [ANSWER:phục vụ trong quân đội], [ANSWER:ứng cử], và [ANSWER:phục vụ trong chính quyền địa phương, tiểu bang hoặc liên bang] (Q.70). Tại sao việc đóng thuế liên bang lại quan trọng? Đó là [ANSWER:theo yêu cầu của pháp luật], và [ANSWER:mọi người đều đóng thuế để hỗ trợ chính phủ liên bang]. Đó là [ANSWER:những gì nước Mỹ yêu cầu], và đó là một [ANSWER:nghĩa vụ công dân] được quy định trong [ANSWER:Điều sửa đổi thứ 16 của Hiến pháp] (Q.71). Cuối cùng, tất cả nam giới từ 18 đến 25 tuổi phải đăng ký với Sở Chỉ huy Tuyển quân vì đó là [ANSWER:theo yêu cầu của pháp luật], đó là một [ANSWER:nghĩa vụ công dân], và để [ANSWER:làm cho việc nhập ngũ công bằng, nếu cần] (Q.72).","Ch5 Sec3 | Questions: [69, 70, 71, 72]"
28,6,0,title,Journey to Freedom: From Colonies to Independence,Hành trình đến Tự do: Từ thuộc địa đến độc lập,Chapter 6 Title
29,6,0,introduction,"It's time to learn how America was born. Long ago, people dreaming of a new life crossed the Atlantic Ocean to this land, and their descendants fought for freedom.","Đã đến lúc tìm hiểu cách nước Mỹ ra đời. Xưa kia, những người mơ ước một cuộc sống mới đã vượt Đại Tây Dương đến vùng đất này, và con cháu của họ đã chiến đấu để giành tự do.",Chapter 6 Introduction
30,6,1,section,"The colonists came to America for many reasons: [ANSWER:freedom], [ANSWER:political liberty], [ANSWER:religious freedom], [ANSWER:economic opportunity], and to [ANSWER:escape persecution] (Q.73). However, before the Europeans arrived, people already lived on this land. They were the [ANSWER:American Indians], also known as [ANSWER:Native Americans] (Q.74). There was also a sad history: [ANSWER:Africans], or [ANSWER:people from Africa], were captured and sold as slaves (Q.75). Over time, the colonists became unhappy with British rule, and eventually, Americans fought a war to gain independence from Britain. This was the [ANSWER:American Revolution], also known as [ANSWER:the American Revolutionary War], or the [ANSWER:War for American Independence] (Q.76). There were many reasons why the United States declared its independence from Great Britain, including [ANSWER:high taxes], [ANSWER:taxation without representation], [ANSWER:British soldiers stayed in colonists' houses], [ANSWER:no self-government], [ANSWER:the Boston Massacre], and [ANSWER:the Boston Tea Party] (Q.77).","Những người thực dân đến Mỹ vì nhiều lý do: [ANSWER:tự do], [ANSWER:tự do chính trị], [ANSWER:tự do tôn giáo], [ANSWER:cơ hội kinh tế], và để [ANSWER:thoát khỏi sự đàn áp] (Q.73). Tuy nhiên, trước khi người châu Âu đến, người dân đã sống trên mảnh đất này. Họ là [ANSWER:người da đỏ Mỹ], còn được gọi là [ANSWER:người Mỹ bản địa] (Q.74). Cũng có một lịch sử buồn: [ANSWER:người châu Phi], hay [ANSWER:những người từ châu Phi], bị bắt và bán làm nô lệ (Q.75). Theo thời gian, những người thực dân trở nên không hài lòng với sự cai trị của Anh, và cuối cùng, người Mỹ đã chiến đấu một cuộc chiến tranh để giành độc lập từ Anh. Đây là [ANSWER:Cách mạng Mỹ], còn được gọi là [ANSWER:Cuộc chiến tranh Cách mạng Mỹ], hoặc [ANSWER:Cuộc chiến tranh giành độc lập của Mỹ] (Q.76). Có nhiều lý do tại sao Hoa Kỳ tuyên bố độc lập khỏi Vương quốc Anh, bao gồm [ANSWER:thuế cao], [ANSWER:đánh thuế mà không có đại diện], [ANSWER:lính Anh ở trong nhà của người dân], [ANSWER:không có tự quản], [ANSWER:Vụ thảm sát Boston], và [ANSWER:Tiệc trà Boston] (Q.77).","Ch6 Sec1 | Questions: [73, 74, 75, 76, 77]"
31,6,2,section,"The Declaration of Independence was written by [ANSWER:Thomas Jefferson] (Q.78). And the date the Declaration of Independence was adopted is [ANSWER:July 4, 1776] (Q.79). There were many important events during the American Revolution. These included the [ANSWER:Battle of Bunker Hill], the [ANSWER:Declaration of Independence], [ANSWER:Washington's Crossing of the Delaware], the [ANSWER:Battle of Saratoga], the [ANSWER:Encampment at Valley Forge], and the [ANSWER:Battle of Yorktown] (Q.80). Initially, there were 13 states: [ANSWER:New Hampshire], [ANSWER:Massachusetts], [ANSWER:Rhode Island], [ANSWER:Connecticut], [ANSWER:New York], [ANSWER:New Jersey], [ANSWER:Pennsylvania], [ANSWER:Delaware], [ANSWER:Maryland], [ANSWER:Virginia], [ANSWER:North Carolina], [ANSWER:South Carolina], and [ANSWER:Georgia] (Q.81). And in 1787, an important founding document was drafted. That was the [ANSWER:U.S. Constitution] (Q.82).","Tuyên ngôn Độc lập được viết bởi [TRẢ LỜI:Thomas Jefferson] (Q.78). Và ngày Tuyên ngôn Độc lập được thông qua là [TRẢ LỜI:4 tháng 7 năm 1776] (Q.79). Có nhiều sự kiện quan trọng trong Cách mạng Hoa Kỳ. Những sự kiện này bao gồm [TRẢ LỜI:Trận Bunker Hill], [TRẢ LỜI:Tuyên ngôn Độc lập], [TRẢ LỜI:Washington vượt sông Delaware], [TRẢ LỜI:Trận Saratoga], [TRẢ LỜI:Trại Valley Forge], và [TRẢ LỜI:Trận Yorktown] (Q.80). Ban đầu, có 13 tiểu bang: [TRẢ LỜI:New Hampshire], [TRẢ LỜI:Massachusetts], [TRẢ LỜI:Rhode Island], [TRẢ LỜI:Connecticut], [TRẢ LỜI:New York], [TRẢ LỜI:New Jersey], [TRẢ LỜI:Pennsylvania], [TRẢ LỜI:Delaware], [TRẢ LỜI:Maryland], [TRẢ LỜI:Virginia], [TRẢ LỜI:North Carolina], [TRẢ LỜI:South Carolina], và [TRẢ LỜI:Georgia] (Q.81). Và vào năm 1787, một tài liệu thành lập quan trọng đã được soạn thảo. Đó là [TRẢ LỜI:Hiến pháp Hoa Kỳ] (Q.82).","Ch6 Sec2 | Questions: [78, 79, 80, 81, 82]"
32,6,3,section,"The Federalist Papers supported the passage of the U.S. Constitution. Its authors were known by the pseudonym [ANSWER:Publius], either [ANSWER:James Madison], [ANSWER:Alexander Hamilton], or [ANSWER:John Jay] (Q.83). The Federalist Papers are important because they [ANSWER:helped people understand the U.S. Constitution] and [ANSWER:supported the passage of the U.S. Constitution] (Q.84). Benjamin Franklin is famous for many reasons, including [ANSWER:founding the first free public libraries], [ANSWER:being the first Postmaster General of the U.S.], [ANSWER:helping to write the Declaration of Independence], [ANSWER:being an inventor], and [ANSWER:being a U.S. diplomat] (Q.85). George Washington is famous as [ANSWER:the Father of Our Country], [ANSWER:the first President of the United States], [ANSWER:the General of the Continental Army], and [ANSWER:the President of the Constitutional Convention] (Q.86).","The Federalist Papers đã ủng hộ việc thông qua Hiến pháp Hoa Kỳ. Các tác giả của nó được biết đến với bút danh [ANSWER:Publius], đó là [ANSWER:James Madison], [ANSWER:Alexander Hamilton], hoặc [ANSWER:John Jay] (Q.83). The Federalist Papers rất quan trọng vì chúng [ANSWER:giúp mọi người hiểu Hiến pháp Hoa Kỳ] và [ANSWER:ủng hộ việc thông qua Hiến pháp Hoa Kỳ] (Q.84). Benjamin Franklin nổi tiếng vì nhiều lý do, bao gồm [ANSWER:thành lập các thư viện công cộng miễn phí đầu tiên], [ANSWER:là Tổng Giám đốc Bưu điện đầu tiên của Hoa Kỳ], [ANSWER:giúp viết Tuyên ngôn Độc lập], [ANSWER:là một nhà phát minh], và [ANSWER:là một nhà ngoại giao Hoa Kỳ] (Q.85). George Washington nổi tiếng với tư cách là [ANSWER:Cha của đất nước chúng ta], [ANSWER:Tổng thống đầu tiên của Hoa Kỳ], [ANSWER:Tướng quân của Lục quân Lục địa], và [ANSWER:Chủ tịch Hội nghị Lập hiến] (Q.86).","Ch6 Sec3 | Questions: [83, 84, 85, 86]"
33,6,4,section,"Thomas Jefferson is famous for various reasons. These include being the [ANSWER:Author of the Declaration of Independence], [ANSWER:Third President of the United States], [ANSWER:Doubled the size of the U.S. territory with the Louisiana Purchase], [ANSWER:First Secretary of State], and [ANSWER:Founder of the University of Virginia] (Q.87). James Madison is known as the [ANSWER:Father of the Constitution], [ANSWER:Fourth President of the United States], [ANSWER:President during the War of 1812], and [ANSWER:One of the writers of the Federalist Papers] (Q.88). Alexander Hamilton is famous as the [ANSWER:First Secretary of the Treasury], [ANSWER:One of the writers of the Federalist Papers], [ANSWER:Helped establish the first bank of the United States], and [ANSWER:Aide to General George Washington] (Q.89). Lastly, the territory the United States bought from France in 1803 was the [ANSWER:Louisiana Territory], or [ANSWER:Louisiana] (Q.90).","Thomas Jefferson nổi tiếng vì nhiều lý do khác nhau. Những lý do này bao gồm việc là [ANSWER:Tác giả Tuyên ngôn Độc lập], [ANSWER:Tổng thống thứ ba của Hoa Kỳ], [ANSWER:Tăng gấp đôi lãnh thổ Hoa Kỳ với vụ mua Louisiana], [ANSWER:Bộ trưởng Ngoại giao đầu tiên], và [ANSWER:Người sáng lập Đại học Virginia] (Q.87). James Madison được biết đến là [ANSWER:Cha đẻ Hiến pháp], [ANSWER:Tổng thống thứ tư của Hoa Kỳ], [ANSWER:Tổng thống trong Chiến tranh năm 1812], và [ANSWER:Một trong những người viết Federalist Papers] (Q.88). Alexander Hamilton nổi tiếng là [ANSWER:Bộ trưởng Ngân khố đầu tiên], [ANSWER:Một trong những người viết Federalist Papers], [ANSWER:Giúp thành lập ngân hàng đầu tiên của Hoa Kỳ], và [ANSWER:Trợ lý của Tướng George Washington] (Q.89). Cuối cùng, lãnh thổ mà Hoa Kỳ mua từ Pháp vào năm 1803 là [ANSWER:Lãnh thổ Louisiana], hoặc [ANSWER:Louisiana] (Q.90).","Ch6 Sec4 | Questions: [87, 88, 89, 90]"
34,7,0,title,Trials and Growth: America in the 1800s,Thử thách và Tăng trưởng: Nước Mỹ những năm 1800,Chapter 7 Title
35,7,0,introduction,"The 1800s were a time of great trials for America. There were wars and conflicts, but within them were also great steps toward freedom and equality.","Những năm 1800 là thời kỳ đầy thử thách đối với Mỹ. Có những cuộc chiến và xung đột, nhưng trong đó cũng có những bước tiến lớn tới tự do và bình đẳng.",Chapter 7 Introduction
36,7,1,section,"In the 1800s, America fought several wars. These included the [ANSWER:War of 1812], the [ANSWER:Mexican-American War], the [ANSWER:Civil War], and the [ANSWER:Spanish-American War] (Q.91). The most tragic of these was the [ANSWER:Civil War], fought between the North and the South (Q.92). Many important events occurred during the Civil War. These included the [ANSWER:Battle of Fort Sumter], the [ANSWER:Emancipation Proclamation], the [ANSWER:Battle of Vicksburg], the [ANSWER:Battle of Gettysburg], [ANSWER:Sherman's March], [ANSWER:Appomattox Surrender], and [ANSWER:Lincoln's Assassination] (Q.93). The greatest leader of this period was Abraham Lincoln. He [ANSWER:freed the slaves], [ANSWER:preserved the Union], [ANSWER:led the United States during the Civil War], was the [ANSWER:16th President of the United States], and is famous for the [ANSWER:Gettysburg Address] (Q.94). The Emancipation Proclamation [ANSWER:freed the slaves], [ANSWER:freed slaves in the Confederacy], and [ANSWER:freed slaves in most Southern states] (Q.95).","Vào những năm 1800, Mỹ đã trải qua một số cuộc chiến tranh. Bao gồm [ANSWER:Chiến tranh năm 1812], [ANSWER:Chiến tranh Mexico-Mỹ], [ANSWER:Nội chiến], và [ANSWER:Chiến tranh Tây Ban Nha-Mỹ] (Q.91). Đau thương nhất trong số đó là [ANSWER:Nội chiến], diễn ra giữa miền Bắc và miền Nam (Q.92). Nhiều sự kiện quan trọng đã xảy ra trong Nội chiến. Bao gồm [ANSWER:Trận Fort Sumter], [ANSWER:Tuyên ngôn Giải phóng Nô lệ], [ANSWER:Trận Vicksburg], [ANSWER:Trận Gettysburg], [ANSWER:Cuộc hành quân của Sherman], [ANSWER:Sự đầu hàng ở Appomattox], và [ANSWER:Vụ ám sát Lincoln] (Q.93). Lãnh đạo vĩ đại nhất trong giai đoạn này là Abraham Lincoln. Ông [ANSWER:giải phóng nô lệ], [ANSWER:duy trì Liên minh], [ANSWER:lãnh đạo Hợp chủng quốc trong Nội chiến], là [ANSWER:Tổng thống thứ 16 của Hợp chủng quốc Hoa Kỳ], và nổi tiếng với [ANSWER:Diễn văn Gettysburg] (Q.94). Tuyên ngôn Giải phóng Nô lệ [ANSWER:giải phóng nô lệ], [ANSWER:giải phóng nô lệ trong Liên minh miền Nam], và [ANSWER:giải phóng nô lệ ở hầu hết các bang miền Nam] (Q.95).","Ch7 Sec1 | Questions: [91, 92, 93, 94, 95]"
37,7,2,section,"The [ANSWER:American Civil War] ended slavery in the United States (Q.96). After the war, important constitutional amendments were made. The [ANSWER:14th Amendment to the U.S. Constitution] defined all persons born or naturalized in the United States and subject to its jurisdiction as citizens of the United States (Q.97). And it was [ANSWER:after the Civil War], [ANSWER:during the Reconstruction Era], by the [ANSWER:15th Amendment to the U.S. Constitution], in [ANSWER:1870], that all men gained the right to vote (Q.98). Leaders of the women's rights movement in the 1800s included [ANSWER:Susan B. Anthony], [ANSWER:Elizabeth Cady Stanton], [ANSWER:Sojourner Truth], and [ANSWER:Harriet Tubman] (Q.99).","[ANSWER:Cuộc Nội chiến Hoa Kỳ] đã chấm dứt chế độ nô lệ ở Hoa Kỳ (Q.96). Sau chiến tranh, các sửa đổi hiến pháp quan trọng đã được thực hiện. [ANSWER:Tu chính án thứ 14 của Hiến pháp Hoa Kỳ] đã định nghĩa tất cả những người sinh ra hoặc nhập quốc tịch ở Hoa Kỳ và chịu sự tài phán của Hoa Kỳ là công dân Hoa Kỳ (Q.97). Và [ANSWER:sau Nội chiến], [ANSWER:trong Kỷ nguyên Tái thiết], bởi [ANSWER:Tu chính án thứ 15 của Hiến pháp Hoa Kỳ], vào [ANSWER:năm 1870], tất cả đàn ông đã giành được quyền bầu cử (Q.98). Các nhà lãnh đạo của phong trào quyền phụ nữ vào những năm 1800 bao gồm [ANSWER:Susan B. Anthony], [ANSWER:Elizabeth Cady Stanton], [ANSWER:Sojourner Truth], và [ANSWER:Harriet Tubman] (Q.99).","Ch7 Sec2 | Questions: [96, 97, 98, 99]"
38,7,3,section,"In the 1900s, the United States fought other wars, including [ANSWER:World War I], [ANSWER:World War II], [ANSWER:Korean War], [ANSWER:Vietnam War], and [ANSWER:Persian Gulf War] (Q.100). The reasons the United States entered World War I were [ANSWER:Germany attacking U.S. civilian ships] and [ANSWER:to support the Allied Powers] (Q.101). All women gained the right to vote in [ANSWER:1920], [ANSWER:after World War I], through the [ANSWER:19th Amendment to the U.S. Constitution] (Q.102). The Great Depression was [ANSWER:the longest economic recession in modern history] (Q.103). The Great Depression began with [ANSWER:the Great Crash of 1929], or [ANSWER:the stock market crash of 1929] (Q.104). The president during the Great Depression and World War II was [ANSWER:Franklin Roosevelt] (Q.105). The reasons the United States entered World War II were [ANSWER:the bombing of Pearl Harbor], [ANSWER:Japan's attack on Pearl Harbor], [ANSWER:to support the Allied Powers], and [ANSWER:to oppose the Axis Powers] (Q.106). Dwight Eisenhower is famous as [ANSWER:a general during World War II], [ANSWER:president at the end of the Korean War], [ANSWER:the 34th President of the United States], and for [ANSWER:signing the Federal-Aid Highway Act of 1956] (Q.107).","Vào những năm 1900, Hoa Kỳ đã tham gia các cuộc chiến tranh khác, bao gồm [TRẢ LỜI:Chiến tranh thế giới thứ nhất], [TRẢ LỜI:Chiến tranh thế giới thứ hai], [TRẢ LỜI:Chiến tranh Triều Tiên], [TRẢ LỜI:Chiến tranh Việt Nam] và [TRẢ LỜI:Chiến tranh vùng Vịnh Ba Tư] (Q.100). Lý do Hoa Kỳ tham gia Chiến tranh thế giới thứ nhất là [TRẢ LỜI:Đức tấn công tàu dân sự của Hoa Kỳ] và [TRẢ LỜI:để hỗ trợ các cường quốc Đồng minh] (Q.101). Tất cả phụ nữ có quyền bầu cử vào [TRẢ LỜI:năm 1920], [TRẢ LỜI:sau Chiến tranh thế giới thứ nhất], thông qua [TRẢ LỜI:Tu chính án thứ 19 của Hiến pháp Hoa Kỳ] (Q.102). Đại suy thoái là [TRẢ LỜI:cuộc suy thoái kinh tế dài nhất trong lịch sử hiện đại] (Q.103). Đại suy thoái bắt đầu với [TRẢ LỜI:Cuộc khủng hoảng lớn năm 1929], hoặc [TRẢ LỜI:sự sụp đổ của thị trường chứng khoán năm 1929] (Q.104). Tổng thống trong thời kỳ Đại suy thoái và Chiến tranh thế giới thứ hai là [TRẢ LỜI:Franklin Roosevelt] (Q.105). Lý do Hoa Kỳ tham gia Chiến tranh thế giới thứ hai là [TRẢ LỜI:vụ đánh bom Trân Châu Cảng], [TRẢ LỜI:Nhật Bản tấn công Trân Châu Cảng], [TRẢ LỜI:để hỗ trợ các cường quốc Đồng minh] và [TRẢ LỜI:để chống lại các cường quốc Trục] (Q.106). Dwight Eisenhower nổi tiếng là [TRẢ LỜI:một vị tướng trong Chiến tranh thế giới thứ hai], [TRẢ LỜI:tổng thống vào cuối Chiến tranh Triều Tiên], [TRẢ LỜI:Tổng thống thứ 34 của Hoa Kỳ] và vì [TRẢ LỜI:ký Đạo luật Đường cao tốc Liên bang năm 1956] (Q.107).","Ch7 Sec3 | Questions: [100, 101, 102, 103, 104, 105, 106, 107]"
39,8,0,title,Modern America and Proud Symbols,Nước Mỹ hiện đại và những biểu tượng đáng tự hào,Chapter 8 Title
40,8,0,introduction,"America's journey continues. Even in modern times, America has faced many challenges and upheld the values of freedom and equality. Now let's learn about the symbols that represent America.","Hành trình của Mỹ vẫn tiếp tục. Ngay cả trong thời hiện đại, Mỹ đã đối mặt với nhiều thách thức và duy trì các giá trị tự do và bình đẳng. Bây giờ chúng ta hãy tìm hiểu về các biểu tượng đại diện cho Mỹ.",Chapter 8 Introduction
