ID,ChapterID,SectionID,Type,English_Full,Spanish_Full,Notes
26,5,2,section,"When we say the Pledge of Allegiance, to what do we pledge our loyalty? We pledge loyalty to the [ANSWER:United States] and to the [ANSWER:flag] (Q.66). In the Oath of Allegiance for new citizens, two important promises are made: to [ANSWER:give up loyalty to other countries], to [ANSWER:defend the United States], to [ANSWER:obey the Constitution], to [ANSWER:obey the laws of the United States], to [ANSWER:serve in the U.S. military] if needed, to [ANSWER:perform important work for the nation] if needed, and to [ANSWER:be loyal to the United States] (Q.67). So, how do people become U.S. citizens? People become citizens by [ANSWER:being born in the United States under the conditions specified in the 14th Amendment to the U.S. Constitution], through [ANSWER:naturalization], or by [ANSWER:obtaining citizenship] (according to conditions set by Congress) (Q.68).","Cuando decimos el Juramento de Lealtad, ¿a qué prometemos nuestra lealtad? Prometemos lealtad a los [ANSWER:Estados Unidos] y a la [ANSWER:bandera] (Q.66). En el Juramento de Lealtad para nuevos ciudadanos, se hacen dos promesas importantes: [ANSWER:renunciar a la lealtad a otros países], [ANSWER:defender los Estados Unidos], [ANSWER:obedecer la Constitución], [ANSWER:obedecer las leyes de los Estados Unidos], [ANSWER:servir en el ejército de los EE. UU.] si es necesario, [ANSWER:realizar trabajos importantes para la nación] si es necesario, y [ANSWER:ser leal a los Estados Unidos] (Q.67). Entonces, ¿cómo se hacen ciudadanos estadounidenses las personas? Las personas se hacen ciudadanos [ANSWER:naciendo en los Estados Unidos bajo las condiciones especificadas en la 14ª Enmienda a la Constitución de los EE. UU.], a través de la [ANSWER:naturalización], o [ANSWER:obteniendo la ciudadanía] (de acuerdo con las condiciones establecidas por el Congreso) (Q.68).","Ch5 Sec2 | Questions: [66, 67, 68]"
27,5,3,section,"There are many ways for citizens to participate in America. These include [ANSWER:voting], [ANSWER:running for office], [ANSWER:joining a political party], [ANSWER:helping with a campaign], [ANSWER:joining a civic group], [ANSWER:joining a local group], [ANSWER:giving an elected official your opinion on an issue], [ANSWER:calling Senators and Representatives], [ANSWER:publicly supporting or opposing an issue or policy], and [ANSWER:writing to a newspaper] (Q.69). There are also various ways for Americans to serve their country. These include [ANSWER:voting], [ANSWER:paying taxes], [ANSWER:obeying the law], [ANSWER:serving in the military], [ANSWER:running for office], and [ANSWER:serving in local, state, or federal government] (Q.70). Why is it important to pay federal taxes? It is [ANSWER:required by law], and [ANSWER:everyone pays taxes to support the federal government]. It is [ANSWER:what America requires], and it is a [ANSWER:civic duty] specified in the [ANSWER:16th Amendment to the Constitution] (Q.71). Finally, all men aged 18 to 25 must register with Selective Service because it is [ANSWER:required by law], it is a [ANSWER:civic duty], and it is to [ANSWER:make the draft fair, if needed] (Q.72).","Hay muchas maneras en que los ciudadanos pueden participar en Estados Unidos. Estas incluyen [ANSWER:votar], [ANSWER:postularse para un cargo], [ANSWER:unirse a un partido político], [ANSWER:ayudar en una campaña], [ANSWER:unirse a un grupo cívico], [ANSWER:unirse a un grupo local], [ANSWER:dar su opinión a un funcionario electo sobre un tema], [ANSWER:llamar a Senadores y Representantes], [ANSWER:apoyar u oponerse públicamente a un tema o política], y [ANSWER:escribir a un periódico] (Q.69). También hay varias maneras en que los estadounidenses pueden servir a su país. Estas incluyen [ANSWER:votar], [ANSWER:pagar impuestos], [ANSWER:obedecer la ley], [ANSWER:servir en el ejército], [ANSWER:postularse para un cargo], y [ANSWER:servir en el gobierno local, estatal o federal] (Q.70). ¿Por qué es importante pagar impuestos federales? Es [ANSWER:requerido por ley], y [ANSWER:todos pagan impuestos para apoyar al gobierno federal]. Es [ANSWER:lo que Estados Unidos requiere], y es un [ANSWER:deber cívico] especificado en la [ANSWER:Enmienda 16 de la Constitución] (Q.71). Finalmente, todos los hombres de 18 a 25 años deben registrarse en el Servicio Selectivo porque es [ANSWER:requerido por ley], es un [ANSWER:deber cívico], y es para [ANSWER:hacer que el reclutamiento sea justo, si es necesario] (Q.72).","Ch5 Sec3 | Questions: [69, 70, 71, 72]"
28,6,0,title,Journey to Freedom: From Colonies to Independence,Viaje a la Libertad: De Colonias a la Independencia,Chapter 6 Title
29,6,0,introduction,"It's time to learn how America was born. Long ago, people dreaming of a new life crossed the Atlantic Ocean to this land, and their descendants fought for freedom.","Es hora de aprender cómo nació América. Hace mucho tiempo, personas que soñaban con una nueva vida cruzaron el Océano Atlántico hasta esta tierra, y sus descendientes lucharon por la libertad.",Chapter 6 Introduction
30,6,1,section,"The colonists came to America for many reasons: [ANSWER:freedom], [ANSWER:political liberty], [ANSWER:religious freedom], [ANSWER:economic opportunity], and to [ANSWER:escape persecution] (Q.73). However, before the Europeans arrived, people already lived on this land. They were the [ANSWER:American Indians], also known as [ANSWER:Native Americans] (Q.74). There was also a sad history: [ANSWER:Africans], or [ANSWER:people from Africa], were captured and sold as slaves (Q.75). Over time, the colonists became unhappy with British rule, and eventually, Americans fought a war to gain independence from Britain. This was the [ANSWER:American Revolution], also known as [ANSWER:the American Revolutionary War], or the [ANSWER:War for American Independence] (Q.76). There were many reasons why the United States declared its independence from Great Britain, including [ANSWER:high taxes], [ANSWER:taxation without representation], [ANSWER:British soldiers stayed in colonists' houses], [ANSWER:no self-government], [ANSWER:the Boston Massacre], and [ANSWER:the Boston Tea Party] (Q.77).","Los colonos llegaron a América por muchas razones: [ANSWER:libertad], [ANSWER:libertad política], [ANSWER:libertad religiosa], [ANSWER:oportunidad económica], y para [ANSWER:escapar de la persecución] (Q.73). Sin embargo, antes de la llegada de los europeos, ya vivían personas en esta tierra. Eran los [ANSWER:indígenas americanos], también conocidos como [ANSWER:nativos americanos] (Q.74). También hubo una historia triste: [ANSWER:africanos], o [ANSWER:gente de África], fueron capturados y vendidos como esclavos (Q.75). Con el tiempo, los colonos se sintieron infelices con el gobierno británico, y finalmente, los americanos lucharon una guerra para obtener la independencia de Gran Bretaña. Esta fue la [ANSWER:Revolución Americana], también conocida como [ANSWER:la Guerra de Independencia Americana], o la [ANSWER:Guerra por la Independencia Americana] (Q.76). Hubo muchas razones por las que Estados Unidos declaró su independencia de Gran Bretaña, incluyendo [ANSWER:impuestos altos], [ANSWER:impuestos sin representación], [ANSWER:soldados británicos se quedaron en las casas de los colonos], [ANSWER:sin autogobierno], [ANSWER:la Masacre de Boston], y [ANSWER:el Motín del Té de Boston] (Q.77).","Ch6 Sec1 | Questions: [73, 74, 75, 76, 77]"
31,6,2,section,"The Declaration of Independence was written by [ANSWER:Thomas Jefferson] (Q.78). And the date the Declaration of Independence was adopted is [ANSWER:July 4, 1776] (Q.79). There were many important events during the American Revolution. These included the [ANSWER:Battle of Bunker Hill], the [ANSWER:Declaration of Independence], [ANSWER:Washington's Crossing of the Delaware], the [ANSWER:Battle of Saratoga], the [ANSWER:Encampment at Valley Forge], and the [ANSWER:Battle of Yorktown] (Q.80). Initially, there were 13 states: [ANSWER:New Hampshire], [ANSWER:Massachusetts], [ANSWER:Rhode Island], [ANSWER:Connecticut], [ANSWER:New York], [ANSWER:New Jersey], [ANSWER:Pennsylvania], [ANSWER:Delaware], [ANSWER:Maryland], [ANSWER:Virginia], [ANSWER:North Carolina], [ANSWER:South Carolina], and [ANSWER:Georgia] (Q.81). And in 1787, an important founding document was drafted. That was the [ANSWER:U.S. Constitution] (Q.82).","La Declaración de Independencia fue escrita por [ANSWER:Thomas Jefferson] (Q.78). Y la fecha en que se adoptó la Declaración de Independencia es el [ANSWER:4 de julio de 1776] (Q.79). Hubo muchos eventos importantes durante la Revolución Americana. Estos incluyeron la [ANSWER:Batalla de Bunker Hill], la [ANSWER:Declaración de Independencia], [ANSWER:el Cruce de Washington del Río Delaware], la [ANSWER:Batalla de Saratoga], el [ANSWER:Campamento de Valley Forge] y la [ANSWER:Batalla de Yorktown] (Q.80). Inicialmente, había 13 estados: [ANSWER:Nuevo Hampshire], [ANSWER:Massachusetts], [ANSWER:Rhode Island], [ANSWER:Connecticut], [ANSWER:Nueva York], [ANSWER:Nueva Jersey], [ANSWER:Pensilvania], [ANSWER:Delaware], [ANSWER:Maryland], [ANSWER:Virginia], [ANSWER:Carolina del Norte], [ANSWER:Carolina del Sur] y [ANSWER:Georgia] (Q.81). Y en 1787, se redactó un importante documento fundacional. Esa fue la [ANSWER:Constitución de los Estados Unidos] (Q.82).","Ch6 Sec2 | Questions: [78, 79, 80, 81, 82]"
32,6,3,section,"The Federalist Papers supported the passage of the U.S. Constitution. Its authors were known by the pseudonym [ANSWER:Publius], either [ANSWER:James Madison], [ANSWER:Alexander Hamilton], or [ANSWER:John Jay] (Q.83). The Federalist Papers are important because they [ANSWER:helped people understand the U.S. Constitution] and [ANSWER:supported the passage of the U.S. Constitution] (Q.84). Benjamin Franklin is famous for many reasons, including [ANSWER:founding the first free public libraries], [ANSWER:being the first Postmaster General of the U.S.], [ANSWER:helping to write the Declaration of Independence], [ANSWER:being an inventor], and [ANSWER:being a U.S. diplomat] (Q.85). George Washington is famous as [ANSWER:the Father of Our Country], [ANSWER:the first President of the United States], [ANSWER:the General of the Continental Army], and [ANSWER:the President of the Constitutional Convention] (Q.86).","Los Documentos Federalistas apoyaron la aprobación de la Constitución de los EE. UU. Sus autores fueron conocidos con el seudónimo [ANSWER:Publius], ya sea [ANSWER:James Madison], [ANSWER:Alexander Hamilton] o [ANSWER:John Jay] (Q.83). Los Documentos Federalistas son importantes porque [ANSWER:ayudaron a la gente a entender la Constitución de los EE. UU.] y [ANSWER:apoyaron la aprobación de la Constitución de los EE. UU.] (Q.84). Benjamin Franklin es famoso por muchas razones, incluyendo [ANSWER:fundar las primeras bibliotecas públicas gratuitas], [ANSWER:ser el primer director general de correos de los EE. UU.], [ANSWER:ayudar a escribir la Declaración de Independencia], [ANSWER:ser un inventor] y [ANSWER:ser un diplomático de los EE. UU.] (Q.85). George Washington es famoso como [ANSWER:el Padre de Nuestro País], [ANSWER:el primer Presidente de los Estados Unidos], [ANSWER:el General del Ejército Continental] y [ANSWER:el Presidente de la Convención Constitucional] (Q.86).","Ch6 Sec3 | Questions: [83, 84, 85, 86]"
33,6,4,section,"Thomas Jefferson is famous for various reasons. These include being the [ANSWER:Author of the Declaration of Independence], [ANSWER:Third President of the United States], [ANSWER:Doubled the size of the U.S. territory with the Louisiana Purchase], [ANSWER:First Secretary of State], and [ANSWER:Founder of the University of Virginia] (Q.87). James Madison is known as the [ANSWER:Father of the Constitution], [ANSWER:Fourth President of the United States], [ANSWER:President during the War of 1812], and [ANSWER:One of the writers of the Federalist Papers] (Q.88). Alexander Hamilton is famous as the [ANSWER:First Secretary of the Treasury], [ANSWER:One of the writers of the Federalist Papers], [ANSWER:Helped establish the first bank of the United States], and [ANSWER:Aide to General George Washington] (Q.89). Lastly, the territory the United States bought from France in 1803 was the [ANSWER:Louisiana Territory], or [ANSWER:Louisiana] (Q.90).","Thomas Jefferson es famoso por varias razones. Estas incluyen ser el [ANSWER:Autor de la Declaración de Independencia], [ANSWER:Tercer Presidente de los Estados Unidos], [ANSWER:Duplicó el tamaño del territorio de los Estados Unidos con la Compra de Luisiana], [ANSWER:Primer Secretario de Estado], y [ANSWER:Fundador de la Universidad de Virginia] (Q.87). James Madison es conocido como el [ANSWER:Padre de la Constitución], [ANSWER:Cuarto Presidente de los Estados Unidos], [ANSWER:Presidente durante la Guerra de 1812], y [ANSWER:Uno de los escritores de los Papeles Federalistas] (Q.88). Alexander Hamilton es famoso como el [ANSWER:Primer Secretario del Tesoro], [ANSWER:Uno de los escritores de los Papeles Federalistas], [ANSWER:Ayudó a establecer el primer banco de los Estados Unidos], y [ANSWER:Ayudante del General George Washington] (Q.89). Por último, el territorio que Estados Unidos compró a Francia en 1803 fue el [ANSWER:Territorio de Luisiana], o [ANSWER:Luisiana] (Q.90).","Ch6 Sec4 | Questions: [87, 88, 89, 90]"
34,7,0,title,Trials and Growth: America in the 1800s,Pruebas y Crecimiento: América en el siglo XIX,Chapter 7 Title
35,7,0,introduction,"The 1800s were a time of great trials for America. There were wars and conflicts, but within them were also great steps toward freedom and equality.","Los años 1800 fueron una época de grandes desafíos para América. Hubo guerras y conflictos, pero dentro de ellos también hubo grandes avances hacia la libertad y la igualdad.",Chapter 7 Introduction
36,7,1,section,"In the 1800s, America fought several wars. These included the [ANSWER:War of 1812], the [ANSWER:Mexican-American War], the [ANSWER:Civil War], and the [ANSWER:Spanish-American War] (Q.91). The most tragic of these was the [ANSWER:Civil War], fought between the North and the South (Q.92). Many important events occurred during the Civil War. These included the [ANSWER:Battle of Fort Sumter], the [ANSWER:Emancipation Proclamation], the [ANSWER:Battle of Vicksburg], the [ANSWER:Battle of Gettysburg], [ANSWER:Sherman's March], [ANSWER:Appomattox Surrender], and [ANSWER:Lincoln's Assassination] (Q.93). The greatest leader of this period was Abraham Lincoln. He [ANSWER:freed the slaves], [ANSWER:preserved the Union], [ANSWER:led the United States during the Civil War], was the [ANSWER:16th President of the United States], and is famous for the [ANSWER:Gettysburg Address] (Q.94). The Emancipation Proclamation [ANSWER:freed the slaves], [ANSWER:freed slaves in the Confederacy], and [ANSWER:freed slaves in most Southern states] (Q.95).","En el siglo XIX, América libró varias guerras. Estas incluyeron la [ANSWER:Guerra de 1812], la [ANSWER:Guerra México-Americana], la [ANSWER:Guerra Civil] y la [ANSWER:Guerra Hispanoamericana] (Q.91). La más trágica de estas fue la [ANSWER:Guerra Civil], librada entre el Norte y el Sur (Q.92). Muchos eventos importantes ocurrieron durante la Guerra Civil. Estos incluyeron la [ANSWER:Batalla de Fort Sumter], la [ANSWER:Proclamación de Emancipación], la [ANSWER:Batalla de Vicksburg], la [ANSWER:Batalla de Gettysburg], la [ANSWER:Marcha de Sherman], la [ANSWER:Rendición de Appomattox] y el [ANSWER:Asesinato de Lincoln] (Q.93). El líder más grande de este período fue Abraham Lincoln. Él [ANSWER:liberó a los esclavos], [ANSWER:preservó la Unión], [ANSWER:lideró a los Estados Unidos durante la Guerra Civil], fue el [ANSWER:16º Presidente de los Estados Unidos] y es famoso por el [ANSWER:Discurso de Gettysburg] (Q.94). La Proclamación de Emancipación [ANSWER:liberó a los esclavos], [ANSWER:liberó a los esclavos en la Confederación] y [ANSWER:liberó a los esclavos en la mayoría de los estados del Sur] (Q.95).","Ch7 Sec1 | Questions: [91, 92, 93, 94, 95]"
37,7,2,section,"The [ANSWER:American Civil War] ended slavery in the United States (Q.96). After the war, important constitutional amendments were made. The [ANSWER:14th Amendment to the U.S. Constitution] defined all persons born or naturalized in the United States and subject to its jurisdiction as citizens of the United States (Q.97). And it was [ANSWER:after the Civil War], [ANSWER:during the Reconstruction Era], by the [ANSWER:15th Amendment to the U.S. Constitution], in [ANSWER:1870], that all men gained the right to vote (Q.98). Leaders of the women's rights movement in the 1800s included [ANSWER:Susan B. Anthony], [ANSWER:Elizabeth Cady Stanton], [ANSWER:Sojourner Truth], and [ANSWER:Harriet Tubman] (Q.99).","La [ANSWER:Guerra Civil Americana] puso fin a la esclavitud en los Estados Unidos (Q.96). Después de la guerra, se hicieron importantes enmiendas constitucionales. La [ANSWER:14ª Enmienda a la Constitución de los EE. UU.] definió a todas las personas nacidas o naturalizadas en los Estados Unidos y sujetas a su jurisdicción como ciudadanos de los Estados Unidos (Q.97). Y fue [ANSWER:después de la Guerra Civil], [ANSWER:durante la Era de la Reconstrucción], por la [ANSWER:15ª Enmienda a la Constitución de los EE. UU.], en [ANSWER:1870], que todos los hombres obtuvieron el derecho al voto (Q.98). Las líderes del movimiento por los derechos de la mujer en el siglo XIX incluyeron a [ANSWER:Susan B. Anthony], [ANSWER:Elizabeth Cady Stanton], [ANSWER:Sojourner Truth] y [ANSWER:Harriet Tubman] (Q.99).","Ch7 Sec2 | Questions: [96, 97, 98, 99]"
38,7,3,section,"In the 1900s, the United States fought other wars, including [ANSWER:World War I], [ANSWER:World War II], [ANSWER:Korean War], [ANSWER:Vietnam War], and [ANSWER:Persian Gulf War] (Q.100). The reasons the United States entered World War I were [ANSWER:Germany attacking U.S. civilian ships] and [ANSWER:to support the Allied Powers] (Q.101). All women gained the right to vote in [ANSWER:1920], [ANSWER:after World War I], through the [ANSWER:19th Amendment to the U.S. Constitution] (Q.102). The Great Depression was [ANSWER:the longest economic recession in modern history] (Q.103). The Great Depression began with [ANSWER:the Great Crash of 1929], or [ANSWER:the stock market crash of 1929] (Q.104). The president during the Great Depression and World War II was [ANSWER:Franklin Roosevelt] (Q.105). The reasons the United States entered World War II were [ANSWER:the bombing of Pearl Harbor], [ANSWER:Japan's attack on Pearl Harbor], [ANSWER:to support the Allied Powers], and [ANSWER:to oppose the Axis Powers] (Q.106). Dwight Eisenhower is famous as [ANSWER:a general during World War II], [ANSWER:president at the end of the Korean War], [ANSWER:the 34th President of the United States], and for [ANSWER:signing the Federal-Aid Highway Act of 1956] (Q.107).","En el siglo XX, Estados Unidos libró otras guerras, incluyendo [ANSWER:La Primera Guerra Mundial], [ANSWER:La Segunda Guerra Mundial], [ANSWER:La Guerra de Corea], [ANSWER:La Guerra de Vietnam] y [ANSWER:La Guerra del Golfo Pérsico] (Q.100). Las razones por las que Estados Unidos entró en la Primera Guerra Mundial fueron [ANSWER:Alemania atacó a los barcos civiles estadounidenses] y [ANSWER:para apoyar a las Potencias Aliadas] (Q.101). Todas las mujeres obtuvieron el derecho al voto en [ANSWER:1920], [ANSWER:después de la Primera Guerra Mundial], a través de la [ANSWER:19.ª Enmienda a la Constitución de los Estados Unidos] (Q.102). La Gran Depresión fue [ANSWER:la recesión económica más larga de la historia moderna] (Q.103). La Gran Depresión comenzó con [ANSWER:el Gran Crack de 1929], o [ANSWER:la caída del mercado de valores de 1929] (Q.104). El presidente durante la Gran Depresión y la Segunda Guerra Mundial fue [ANSWER:Franklin Roosevelt] (Q.105). Las razones por las que Estados Unidos entró en la Segunda Guerra Mundial fueron [ANSWER:el bombardeo de Pearl Harbor], [ANSWER:el ataque de Japón a Pearl Harbor], [ANSWER:para apoyar a las Potencias Aliadas] y [ANSWER:para oponerse a las Potencias del Eje] (Q.106). Dwight Eisenhower es famoso como [ANSWER:un general durante la Segunda Guerra Mundial], [ANSWER:presidente al final de la Guerra de Corea], [ANSWER:el 34.º Presidente de los Estados Unidos] y por [ANSWER:firmar la Ley Federal de Carreteras de 1956] (Q.107).","Ch7 Sec3 | Questions: [100, 101, 102, 103, 104, 105, 106, 107]"
39,8,0,title,Modern America and Proud Symbols,América Moderna y Símbolos de Orgullo,Chapter 8 Title
40,8,0,introduction,"America's journey continues. Even in modern times, America has faced many challenges and upheld the values of freedom and equality. Now let's learn about the symbols that represent America.","El camino de América continúa. Incluso en los tiempos modernos, América ha enfrentado muchos desafíos y ha mantenido los valores de libertad e igualdad. Ahora, aprendamos sobre los símbolos que representan a América.",Chapter 8 Introduction
41,8,1,section,"During the Cold War, America's main rivals were the Soviet Union, also known as the Soviet Union or Russia (Q.108). During the Cold War, America's biggest worries were Communism and nuclear war (Q.109). The United States participated in the Korean War to stop the spread of Communism (Q.110), and for the same reason, participated in the Vietnam War (Q.111). American civil rights movements fought to end racial discrimination (Q.112). Martin Luther King, Jr. fought for civil rights, struggled for equality in America, and worked for people to be judged by who they are, not by the color of their skin (Q.113). The United States participated in the Persian Gulf War to drive the Iraqi army out of Kuwait (Q.114).","Durante la Guerra Fría, los principales rivales de Estados Unidos fueron la Unión Soviética, también conocida como la Unión Soviética o Rusia (Q.108). Durante la Guerra Fría, las mayores preocupaciones de Estados Unidos fueron el comunismo y la guerra nuclear (Q.109). Estados Unidos participó en la Guerra de Corea para detener la propagación del comunismo (Q.110), y por la misma razón, participó en la Guerra de Vietnam (Q.111). Los movimientos por los derechos civiles estadounidenses lucharon para poner fin a la discriminación racial (Q.112). Martin Luther King, Jr. luchó por los derechos civiles, luchó por la igualdad en Estados Unidos y trabajó para que las personas fueran juzgadas por quienes son, no por el color de su piel (Q.113). Estados Unidos participó en la Guerra del Golfo Pérsico para expulsar al ejército iraquí de Kuwait (Q.114).","Ch8 Sec1 | Questions: [108, 109, 110, 111, 112, 113, 114]"
42,8,2,section,"In the United States, a major event occurred on September 11, 2001. [ANSWER:Terrorists attacked the United States], [ANSWER:Terrorists hijacked two planes and crashed them into the World Trade Center in New York City], and [ANSWER:Terrorists hijacked a plane and crashed it into the Pentagon in Arlington, Virginia] (Q.115). After the attacks of September 11, 2001, U.S. military conflicts included the [ANSWER:Global War on Terror], [ANSWER:War in Afghanistan], and [ANSWER:Iraq War] (Q.116). Many Native American tribes in the United States include the [ANSWER:Apache], [ANSWER:Cherokee], [ANSWER:Navajo], and [ANSWER:Sioux] (Q.117). Examples of American innovation include the [ANSWER:light bulb], [ANSWER:automobile], [ANSWER:skyscraper], [ANSWER:airplane], [ANSWER:assembly line], and [ANSWER:moon landing] (Q.118). The capital of the United States is [ANSWER:Washington D.C.] (Q.119). The Statue of Liberty is located in [ANSWER:New York Harbor], [ANSWER:Liberty Island] (Q.120).","En los Estados Unidos, un evento importante ocurrió el 11 de septiembre de 2001. [ANSWER:Terroristas atacaron los Estados Unidos], [ANSWER:Terroristas secuestraron dos aviones y los estrellaron contra el World Trade Center en la ciudad de Nueva York], y [ANSWER:Terroristas secuestraron un avión y lo estrellaron contra el Pentágono en Arlington, Virginia] (Q.115). Después de los ataques del 11 de septiembre de 2001, los conflictos militares de Estados Unidos incluyeron la [ANSWER:Guerra Global contra el Terrorismo], [ANSWER:Guerra en Afganistán], y la [ANSWER:Guerra de Irak] (Q.116). Muchas tribus nativas americanas en los Estados Unidos incluyen los [ANSWER:Apaches], [ANSWER:Cherokees], [ANSWER:Navajos], y [ANSWER:Sioux] (Q.117). Ejemplos de innovación estadounidense incluyen la [ANSWER:bombilla], el [ANSWER:automóvil], el [ANSWER:rascacielos], el [ANSWER:avión], la [ANSWER:cadena de montaje], y el [ANSWER:aterrizaje lunar] (Q.118). La capital de los Estados Unidos es [ANSWER:Washington D.C.] (Q.119). La Estatua de la Libertad está ubicada en [ANSWER:el puerto de Nueva York], [ANSWER:la Isla de la Libertad] (Q.120).","Ch8 Sec2 | Questions: [115, 116, 117, 118, 119, 120]"
